{
  "idea_source_id": "idea_life_force_robbins_diamandis_hariri",
  "schema_version": "0.1.0",
  "title": "Life Force: How New Breakthroughs in Precision Medicine Can Transform the Quality of Your Life & Those You Love",
  "creators": ["Tony Robbins", "Peter H. Diamandis", "Robert Hariri"],
  "kind": "book",
  "publisher": "Simon & Schuster",
  "publication_year": 2022,
  "isbn": "9781982121709",
  "authority_url": "https://www.simonandschuster.com/books/Life-Force/Tony-Robbins/9781982121709",
  "discovery_tier": "idea_source_only",
  "content_policy": "bibliographic_metadata_only_no_copyrighted_full_text",
  "claim_admission_rule": "resolve_to_primary_systematic_review_or_guideline_before_user_facing_advice",
  "notes": "Public-safe bibliographic example identified from a user-supplied photograph. No photographed page, excerpt, or copyrighted full text is stored. Claims from this book are candidates for independent verification, not evidence by themselves.",
  "retrieved_on": "2026-08-24"
}
